"DESCRIPTION","DURATION IN MS","NAME","PARENT SUITE","START TIME","STATUS","STOP TIME","SUB SUITE","SUITE","TEST CLASS","TEST METHOD"
"","3397","should sort issues by ID ASC","chromium","Tue Jan 07 16:26:33 UTC 2025","passed","Tue Jan 07 16:26:36 UTC 2025","","redmine_testing.spec.js","",""
"","5374","should not log in with invalid credentials","chromium","Tue Jan 07 16:26:28 UTC 2025","passed","Tue Jan 07 16:26:33 UTC 2025","","redmine_testing.spec.js","",""
"","5134","should register with valid credentials without email confirmation","chromium","Tue Jan 07 16:26:22 UTC 2025","passed","Tue Jan 07 16:26:28 UTC 2025","","redmine_testing.spec.js","",""
"","2853","should verify link to the installation guide in FAQ section","chromium","Tue Jan 07 16:26:40 UTC 2025","passed","Tue Jan 07 16:26:43 UTC 2025","","redmine_testing.spec.js","",""
"","3277","should search by keyword with filters","chromium","Tue Jan 07 16:26:36 UTC 2025","passed","Tue Jan 07 16:26:40 UTC 2025","","redmine_testing.spec.js","",""
