"DESCRIPTION","DURATION IN MS","NAME","PARENT SUITE","START TIME","STATUS","STOP TIME","SUB SUITE","SUITE","TEST CLASS","TEST METHOD"
"","2896","should verify link to the installation guide in FAQ section","chromium","Tue Jan 07 15:11:35 UTC 2025","passed","Tue Jan 07 15:11:38 UTC 2025","","redmine_testing.spec.js","",""
"","4704","should register with valid credentials without email confirmation","chromium","Tue Jan 07 15:11:19 UTC 2025","passed","Tue Jan 07 15:11:23 UTC 2025","","redmine_testing.spec.js","",""
"","4812","should not log in with invalid credentials","chromium","Tue Jan 07 15:11:24 UTC 2025","passed","Tue Jan 07 15:11:28 UTC 2025","","redmine_testing.spec.js","",""
"","3456","should sort issues by ID ASC","chromium","Tue Jan 07 15:11:28 UTC 2025","passed","Tue Jan 07 15:11:32 UTC 2025","","redmine_testing.spec.js","",""
"","3233","should search by keyword with filters","chromium","Tue Jan 07 15:11:32 UTC 2025","passed","Tue Jan 07 15:11:35 UTC 2025","","redmine_testing.spec.js","",""
