"DESCRIPTION","DURATION IN MS","NAME","PARENT SUITE","START TIME","STATUS","STOP TIME","SUB SUITE","SUITE","TEST CLASS","TEST METHOD"
"","5053","should not log in with invalid credentials","chromium","Tue Jan 07 12:09:51 UTC 2025","passed","Tue Jan 07 12:09:56 UTC 2025","","redmine_testing.spec.js","",""
"","3172","should search by keyword with filters","chromium","Tue Jan 07 12:09:59 UTC 2025","passed","Tue Jan 07 12:10:03 UTC 2025","","redmine_testing.spec.js","",""
"","3429","should sort issues by ID ASC","chromium","Tue Jan 07 12:09:56 UTC 2025","passed","Tue Jan 07 12:09:59 UTC 2025","","redmine_testing.spec.js","",""
"","2734","should verify link to the installation guide in FAQ section","chromium","Tue Jan 07 12:10:03 UTC 2025","passed","Tue Jan 07 12:10:05 UTC 2025","","redmine_testing.spec.js","",""
"","4631","should register with valid credentials without email confirmation","chromium","Tue Jan 07 12:09:46 UTC 2025","passed","Tue Jan 07 12:09:51 UTC 2025","","redmine_testing.spec.js","",""
