"DESCRIPTION","DURATION IN MS","NAME","PARENT SUITE","START TIME","STATUS","STOP TIME","SUB SUITE","SUITE","TEST CLASS","TEST METHOD"
"","6213","should register with valid credentials without email confirmation","chromium","Tue Jan 07 14:34:00 UTC 2025","passed","Tue Jan 07 14:34:06 UTC 2025","","redmine_testing.spec.js","",""
"","8091","should verify link to the installation guide in FAQ section","chromium","Tue Jan 07 14:34:37 UTC 2025","failed","Tue Jan 07 14:34:45 UTC 2025","","redmine_testing.spec.js","",""
"","4928","should not log in with invalid credentials","chromium","Tue Jan 07 14:34:06 UTC 2025","passed","Tue Jan 07 14:34:11 UTC 2025","","redmine_testing.spec.js","",""
"","3712","should sort issues by ID ASC","chromium","Tue Jan 07 14:34:11 UTC 2025","passed","Tue Jan 07 14:34:15 UTC 2025","","redmine_testing.spec.js","",""
"","3443","should search by keyword with filters","chromium","Tue Jan 07 14:34:15 UTC 2025","passed","Tue Jan 07 14:34:18 UTC 2025","","redmine_testing.spec.js","",""
